{
  "spec": "chit.cgp.v0.1",
  "meta": {
    "backend": "mini-vec-4d",
    "bins": 5
  },
  "super_nodes": [
    {
      "id": "super_0",
      "constellations": [
        {
          "id": "const_0_0",
          "anchor": [
            0.8,
            0.2,
            0.0,
            0.0
          ],
          "anchor_enc": null,
          "summary": "Basketball-ish",
          "radial_minmax": [
            0.0,
            1.0
          ],
          "spectrum": [
            0.05,
            0.15,
            0.3,
            0.3,
            0.2
          ],
          "points": []
        }
      ]
    }
  ],
  "sig": null
}